text,date,year
" The Alexander Vinnik case in Greece has just taken an interesting turn. As we reported back in November, the Russian cybercrime suspect was awaiting his fate as the U.S and Russia battled for his extradition. Vinnik was arrested back in July when the U.S requested that he be arrested as he was on vacation with his family. He is said to have laundered $4 billion USD worth of Bitcoin through BTC-e.  Vinnik had appealed his extradition to the U.S because his home country, Russia, held him on ridiculously lower charges of laundering 667,000 ruble which is around only $11,500 USD.  Greece’s Supreme Court has now upheld the US request and is supporting the extradition to the North California courts. Vinnik’s lawyer said in an official statement following the ruling stating, “The Supreme Court has in essence accepted that our client should be sent to the United States.” It is now up to the justice minister to decide his ultimate fate, as the two options present radically different legal punishments.   Featured Image: twitter",15-Dec,2017
" Tom Lee, who co-founded the Fundstrat market research company, has publicly stated that the price of Bitcoin will only continue to increase. According to Lee, bitcoin will continue to see growth because millennials have taken such an intense interest in it. The strategist has said that the millennial generation will power the currency, comparing it to the way baby boomers helped the stock market in the 80s. On Tuesday, December 12, Lee stated that millennials have taken a liking to not only bitcoin but also social media and digital organizations. “I think what viewers have to appreciate is, this is a millennial story,” Lee said. Back in October of this year, Tom Lee forecasted that the virtual currency will eventually hit the $25,000 mark by the year 2022. These predictions don’t seem that far-fetched either considering during 2017 bitcoin has posted a whopping 1,700% growth, hitting more than $17,00 this month. Additionally, with CME Group’s launch of bitcoin futures, there is a good chance the price of bitcoin will continue to increase. Featured Image: depositphotos/stevanovicigor",15-Dec,2017
" Jordan Belfort, the guy that the ‘Wolf of Wall Street’ was based on, has recently voiced his opinion on Bitcoin and the Initial Coin Offerings.  In an interview this week with the Financial Times on CNN, Belfort discussed his thoughts on the world’s first digital currency and the issues he finds with it.  While, he believes there will be further implementation of the digital currency more mainstream he doesn’t see the value of it, due to its limited supply. Belfort talks about the “shorting” that is currently occurring with the Bitcoin futures and believes it will catapult the price and the demand. However, he doubts with the limited supply and due to the possibility of regulations from various places, the digital currency will fall sharply.   The major issue he has with cryptocurrency is the fundraising tactics of initial coin offerings, calling them a “gigantic scam” that will eventually blow up in investors faces. He made a statement pretty profound, as he was found guilty of fraud to stock-market manipulation but he adds that ICOs are, “far worse than anything I was ever doing.” He essentially doesn’t see anything wrong with digital currency or even the fundraising but says that the majority of people don’t have ill intentions but the small amount that do, will ruin it for everyone. He is alongside a lot of individuals comparing the Bitcoin rise to the “Tulip Bulb” crisis in Holland back in the 1960s, pointing out that once people started trading futures of the commodity, it came crashing down.  He does believe that people are able to make some money on this cryptocurrency frenzy but need to be able to “pull” out and not enter again. Ultimately, he believes due to human nature this entire thing will blow up in everyone’s face and gives a clear warning of this. He states that it won’t affect these billionaire investors but will be devastating to the ‘middle-class’ average joes that place their bets on the market. Featured Image: YouBeRelentless",14-Dec,2017
" Benjamin Netanyahu, Israeli Prime Minister, published a video over the internet on Tuesday expressing his views on our current traditional banking systems. He believes that they will eventually become obsolete and that Bitcoin would replace them entirely. Netanyahu bases his entire claim based on blockchain technologies’ trustless nature and the growth the cryptocurrency has seen within the last year.  In the video, the Prime Minister states that banks will eventually become outdated and easily replaced, saying, “Is the fate of banks that they will eventually disappear? Yes. The answer is yes. Does it need to happen tomorrow? And do we need to do it through Bitcoin? That’s a question mark.” The head of the Israeli state also spoke on the roles of banks explaining that their primary reason for existence was to ensure transactions between two people are secure and valid. He also states that the banks control how money is spent and benefit from having that control, at the cost of the transacting parties. Blockchain technology allows users to communicate directly and secures and validates transactions more quickly, in comparison to the traditional banking infrastructure currently.  Featured Image: facebook",14-Dec,2017
" Scott Cutler, eBay’s (NYSE:EBAY) senior vice president, recently announced that his company is seriously considering accepting the world’s largest cryptocurrency, Bitcoin, as a payment method. On the platform itself, there is an array of items that have to do with cryptocurrency from various apparel with bitcoin emblem’s placed on them, mining contracts, hardware wallets and even mining computers. The one major thing missing, is being able to purchase goods in the cryptocurrency.  According to Cutler, the company is not quite there “yet.” This move would be a massive step towards the adoption of the digital currency. However, Steam, an online game retailer, just announced they will no longer accept Bitcoin as a means of purchase on their platform due to time it takes between the customer’s purchase and the company actually receiving the funds.  The difference between Steam and eBay’s platforms is that eBay is a marketplace, and it wouldn’t matter to them which currency is used as long as they receive their fee per transaction. The acceptance of the payment model wouldn’t be that much of a hindrance for the company, as it was for Steam so it’s adoption seems promising.  Craigslist just started accepting Bitcoin as a form of payment on-the-low but didn’t announce its new features to the public. For now, the eBay collaboration is in the idea phase, but with the holiday’s knocking on the door it might happen sooner rather than later. Featured Image: twitter",13-Dec,2017
" Craig Wright, the self-proclaimed creator of Bitcoin, claims that 2018 will be the year of Bitcoin Cash. Wright tweeted that Bitcoin Cash (BCH) had everything to gain in 2018; it will have more security, and what it will be capable of achieving will be limitless. He said that 2018 will bring “secure threshold systems to make even web wallets secure.” There will also be an improvement in privacy by making transactions blind, and there will be improved mixers. Wright further said that the BCH team would be spreading the cryptocurrency around the world, getting more people using it and thus driving the price up. When asked if the 2018 roadmap was well planned, Wright tweeted back, “It is well planned. There are many things coming. We are interested in delivering cash to the world. Not a bank settlement system. So, it is all about whether you believe in PayPal 1.5 in BTC or global cash in BCH.” Wright is asking users to come up with merchant solutions to help with the progress of BCH and is expecting a higher user rate of the cryptocurrency with the many new services and businesses climbing on board. The mining pool ViaBTC will be launching a crypto-to-crypto exchange platform that will have a focus on BCH, and there will also be a Bitcoin Cash Visa debit card coming out. Only time will tell whether the new year will bring a new spring to Bitcoin Cash’s step. Featured Image: Depositphotos/© PromesaStudio",13-Dec,2017
" Co-owner of the Golden State Warriors and founder of the Social Capital, Chamath Palihapitiya, has just voiced his opinion of the potential growth of Bitcoin in an Interview with CNBC yesterday. The business head invested in the world’s first digital currency back in 2012 and believes the cryptocurrency will rise exponentially in the next twenty years as it more adopted mainstream. His price analysis isn’t far off from many other investors and tech leaders, who have predicted the price of Bitcoin to reach close to the $1 million level. In his interview Palihapitiya explains his predictions as such: “This thing has the potential to be comparable to the value of gold…This is a fantastic hedge and store of value against autocratic regimes and banking infrastructure that we know is corrosive to how the world needs to work properly…I think this thing is a $100,000 a coin in the next 3-4 years, and in the next 20 years will be $1 mln.” The founder’s main argument is that the digital currency offers a cover against the massive problems that could be potentially caused by the world’s current banking structure. If the banks were to fail, like the housing crisis back in 2008, Bitcoin is entirely disconnected from the platform and that’s the exact reason why the digital currency was created in the first place. He ended the interview with the advice to put at least one percent of what you invest into Bitcoin because he believes, it may “save us all.” Featured Image: Depositphotos/© yamabikay",13-Dec,2017
" Ron Paul, who is a former Republican Congressman and known gold standard supporter, has announced that he is shocked to hear that roughly half of his Twitter followers would choose to invest in bitcoin over gold.  According to CCN, Ron Paul designed a poll on his Twitter in which he asked his followers where they would invest a $10,000 gift that they could not touch for roughly 10 years. In the poll, Paul let his followers choose from Bitcoin, Gold, Federal Reserve Notes, or 10 year U.S. Treasury Bonds.  The results? More than half of respondents (70,513 users voted) said they would rather invest in bitcoin, while 36% said they would rather invest in gold.  In an interview with Kitco News, Ron Paul disclosed that he was “surprised” by the results that the poll showed. However, he felt a bit better that the majority of people would not entrust their $10,000 investment to a government-connected financial instrument.  Here’s what Paul had to say:  “Of course, bitcoin is very exciting, and it’s booming, but [bitcoin investors] don’t have a long-term perspective. What’s it going to be like in 10 years? Nobody knows. But we have a pretty good idea of where gold will be, in a general sense.” Keep in mind this poll was not scientific, and it was also posted on Twitter, which usually has a young demographic – just like digital currency investors.  Featured Image: twitter",11-Dec,2017
" On Sunday, CBOE (NASDAQ:CBOE) started trading futures on Bitcoin, and on Monday, CBOE’S chief executive called out critics who have said that the exchange’s newly-launched bitcoin futures market was rushed.  Edward Tilly gave an interview to Financial News in which he said that the issues he has received about the futures market, such as those raised by the Futures Industry Association last week, were completely “uncalled for” and that in no way does it reflect the reality of the regulatory approval process.  Here’s what Tilly had to say, “I think letters like that and cheap shots to our regulator, the CFTC, are uncalled for to make it seem this was an overnight self-certification without the proper amount of CFTC involvement. This is just irresponsible. I respect all the concerns that the industry has but when it’s articulated in the way the FIA did, not so much.” For those who don’t know, FIA’s chief executive Walt Lukken said last week that a number of members were worried about the fluctuation surrounding the digital currency’s prices. He also attacked the process that led to CBOE’s futures market launch yesterday evening.  “I think letters like that and cheap shots to our regulator, the CFTC, are uncalled for to make it seem this was an overnight self-certification without the proper amount of CFTC involvement. This is just irresponsible. I respect all the concerns that the industry has but when it’s articulated in the way the FIA did, not so much,” Lukken said. It’s not just Lukken who raised objections either. In fact, a number of issues were raised by Thomas Peterffy who founded Interactive Brokers. Featured Image: twitter",11-Dec,2017
" There’s no doubt that the Bitcoin phase has blown up, but now it’s starting to really get out of hand. According to securities regulator Joseph Borg, people have started going as far as taking out mortgages in order to buy Bitcoin. And this, says Borg, is a huge mistake, “This is not something a guy who’s making $100,000 a year, who’s got a mortgage and two kids in college ought to be invested in.” Most recently, Bitcoin was trading at $16,700 on Coinbase. But it’s a volatile industry, its price constantly changing, up and down. There’s not going to be anywhere to hide if the bubble bursts, which some people believe could happen at any moment. That’s not a place you want to be in, especially not with a new mortgage on the line. The Bitcoin craze, increasing since the beginning of the year, might finally be getting out of hand if this is how far people are willing to go to get a piece of the action – and it’s probably going to go even further. Featured Image: twitter",11-Dec,2017
" Kay Van-Peterson, Saxo Bank’s global macro strategist, has recently stated that he anticipated Bitcoin to reach “$50,000 – $100,000 between the next six to eighteen months.” He spoke to Bloomberg recently and explained that the new influx of large institutional money will be the “catalyst” that pushes Bitcoin’s price higher.  Van-Peterson also believes the other cryptocurrencies could benefit and “do better” in regards to price growth from this. The strategist sees Ethereum being the next candidate for EFTs and the next ‘contender’ in the cryptocurrency arena.  He added, “The astonishing thing – mindblowing if you will – is that you take a step back and look at the price appreciation… a lot of this has happened without traditional institutional money, and that’s basically going to be coming on board over the next six to 18 months.” Bitcoin has had a monumental year, passing most financial analysts predictions for its short-term growth and many are now pondering what could be next for the digital currency. Even Van-Peterson’s prediction back in May of Bitcoin hitting $100,000 within the next ten years, is now less surprising as he has now altered his timeframe for the digital currency. Bitcoin’s price has recovered over the weekend as CBOE’s futures launched successfully, as it is currently selling around the $16,700 mark as it dropped below $13,000 during the weekend. Featured Image: twitter",11-Dec,2017
" Bitcoin has made its way into mainstream news within the last months and while it launched back in 2009, a new wave of adoption and understanding has catapulted its price in the year of 2017 over 2,000 percent.    Despite the new adoption and influx of investors, the core Bitcoin users remain to be a tight-knit small group. These early adopters, who happen to be a mix of technology devotees and bold entrepreneurs, hold a large majority of the sway of the cryptocurrency.  The holders of large amounts of bitcoin are called “whales” and according to bloomberg, only 1,000 people currently hold 40 percent of all the existing 16,734,762 circulating Bitcoin supply. So, how much control do these 1,000 people really have over the entire Bitcoin market? What happens if one day they decide to cash out, simultaneously or decide to join the futures route? The world’s largest cryptocurrency, recently saw a dip after a monstrous rally as it’s two biggest exchanges went offline after record-breaking traffic. Bitcoin hit around the $19,000 mark before crashing to nearly $14,000 in mere hours, over a 20 percent drop. The reason for this dip was due to fear and others cashing out for bigger profits.  This example of a minor market manipulation shows how just a few thousand coins can make the market move, should large groups decide to buy/sell. Also, this particular manipulation is not exactly coordinated and just all a part of the process but what is there was a coordinated move? Back on November 12th, an undisclosed individual moved almost 25,000 bitcoins, which was worth $159 million at the time, to a specific online exchange. The news broke throughout the community and many traders feared the owner selling that large amount at one time. It never occurred but many within the Bitcoin community feared the potential ramifications of selling of such a large amount of the cryptocurrency at once. Many fear the high volatility of Bitcoin, which is inevitably the only thing that is predictable with its market. There are many, though, that welcome the dip in the cryptocurrency and see it as an opportunity to buy up “discounted” Bitcoins. Thus emphasizing the issue, a coordinated sell-off between the whales could potentially cause a “flood” in the market and the move would manipulate it to a lower price. There have also been rumors of a trader with unlimited money who was personally manipulating the Bitcoin market. There has been no sign of a coordinated strike between these whales, yet. Who knows if they even understand the magnitude of their alliance or if they even know who each other are. Entering this week though, there are dangers lurking as the first round of Bitcoin futures have launched on CBOE. CME is set to the launch their futures contracts on Sunday and NASDAQ in their Q2 in 2018.  These futures allow different sets of Bitcoin investors to enter the market, which could completely make the current Bitcoin whales almost insignificant with the amount of money that could be potentially dumped in. However, with futures trading, there is a protection for a big price drop, and also a big opportunity to profit from either a drop or a rise. This means big incentives for investors to manipulate Bitcoin’s small market, with large amounts of money. Will these Whales also jump on these futures and manipulate its price to gain profit?  We shall see. Featured Image: Depositphotos/© Christian",11-Dec,2017
" Tomorrow, a hard fork is set to initiate on the Bitcoin blockchain, thus creating Super Bitcoin which its developers claim will “Make Bitcoin great again.” Super Bitcoin, is part of a group of forks that are set to emerge from Bitcoin’s core chain in the month of December. Tomorrow’s fork comes from a Chinese group that is looking to optimize the blockchain with the Lightning network and plans on increasing its block size to 8-MB. The new chain is set for block 498,888, which will occur sometime on Monday, December 12. Developers on the project state their launch was due to the ideas in the Bitcoin community and have expressed on their website, “please remember: this is just an experiment.” The website reads, “We are merely implementing the proposals recommended by the Bitcoin community. Only when we put these talks into actions that we can make Bitcoin great again.” Super Bitcoin will supply 21,210,000 coins which will include 210,000 pre-mined coins.  According to current lists, f2ppol and BTCC will support the fork on their mining pools and 21 exchanges are set to trade the new currency. Featured Image: twitter",11-Dec,2017
" Bitcoin has now landed on Wall Street, with a bang.   Source: CoinMarketCap The CBOE Global Market Exchange Inc. launched its Bitcoin futures last night and the world’s largest cryptocurrency saw a 26 percent increase upon the debut. The initial volumes that came into the exchange exceeded expectation and CBOE’s website traffic was pushed to its limits causing major delays and brief outages. Unlike the outages that occurred last week on the Coinbase system, the CBOE outage didn’t cause Bitcoin’s price to fall.   Source: Bloomberg What are Bitcoin futures exactly? Futures trading has been around since the 19th century and it allows two parties to exchange an asset, at a specific price on an agreed upon date in the future. When this contract settles the buyer of the contract receives their payment in the product itself or in cash. These exchanges will halt for brief periods, if the price of the cryptocurrency spikes more than 30 percent, as you can see displayed on the chart above. CBOE and the upcoming CME futures, ill be settled in cash. This is appealing to mainstream investors because they can bet on the price of Bitcoin, without having to hold on the cryptocurrency what-so-ever.  CBOE’s Chief Strategy Officer Jon Deters, told Business Insider, “People will be able to settle in cash. So you can take a speculative position without touching bitcoin itself, which helps make it more attractive to all sorts of folks.” The arrivals of these futures is a huge milestone for the digital currency, as it was once only associated with drug dealing and other illegal activities, by investors.  These futures are anticipated to bring down the high volatility of the cryptocurrency as major institutions and high volumes of money, are involved. Still, the futures and their impact are still a big unknown – as the week progresses and CME launches their contracts next Sunday, we will know soon-enough. Featured Image: twitter",11-Dec,2017
" With little information on the fork, experts are calling Bitcoin Platinum a scam, created by a South Korean teenager. Despite Bitcoin Platinum’s official Twitter feed claiming there has been a group of miners, developers, investors, and users ready to hard fork the Bitcoin protocol at block 498,577, little further information has been provided. Bitcoin Platinum has had a vague description from the start. It claimed to use “Satoshi’s original vision of Bitcoin as decentralized electronic cash.” Subsequent tweets from the account have looked to be informal and poorly constructed, offering little information beyond “[Bitcoin] shorting very good.” It has been revealed since that the owner of the Bitcoin Platinum account is a South Korean teenager, who later admitted on Twitter that it was, indeed, a scam. No doubt due to this and other cryptocurrency scams, the South Korean government will begin to regulate the South Korean crypto market. Featured Image: twitter",11-Dec,2017
" On December 11, New York-based VanEck, an ETF fund provider, filed with the United States Securities and Exchange Commission to develop Bitcoin ETF products that are eligible to trade in cryptocurrency derivatives.  However, this is not the first ETF fund provider to do this. On December 8, Connecticut-based REX filed its own application.  According to the SEC public filing system, neither REX nor VanEck plans on holding onto bitcoins directly. Instead, both firms will trade futures contracts as well as other derivatives products in order to allow potential investors to profit from the fluctuations bitcoin tends to see in price.  While the SEC tends to deny, or just not bother to look at applications from ETF fund providers to develop Bitcoin ETFs, CBOE (NASDAQ:CBOE) just launched their bitcoin futures market on Sunday, and LedgerX just rolled out a number of other derivatives products.  Featured Image: Depositphotos/© Syda_Productions",11-Dec,2017
" On Sunday evening, Bitcoin prices surged as soon as the Cboe Futures Exchange commenced trading futures on the digital currency. The Cboe exchange rolled out the futures under the stock ticker symbol ‘XBT’. As of 6 p.m. New York time, bitcoin was at $14,890 and then proceeded to jump to $15,500.13 as of 7:17 p.m. on the Coinbase exchange. In early trading on the Cboe, the new futures were at $15,860, which is up 2.6%. Even though things turned sour around 7 p.m. New York time, the digital currency quickly made a comeback. Here’s what JJ Kinahan, chief market strategist at TD Ameritrade, had to say about Sunday’s news: “So far, trading has been smooth. I think that was the biggest worry for people. We’ve been trading for about an hour and more than 700 contracts have been traded. So, I’d say this is a successful launch.” Up until this point bitcoin had been primarily owned and traded by entrepreneurs, but now, the launch allows for institutional investors to buy into the digital currency space. Featured Image: Depositphotos/© spaxiax",10-Dec,2017
