title,date
Bitcoin and Altcoins Positioned for Further Upsides,2018-06-06
"Bitcoin, ICOs Slowing Down and Looking For New Narrative",2018-06-05
Bitcoin Is Struggling to Hold Gains,2018-06-05
Market Weekly Outlook: Bitcoin Holding Uptrend Support,2018-06-04
Bitcoin and Altcoins Remains Attractive to Buyers,2018-06-01
Bitcoin May Be at Profit-Taking Stage of a Bubble - Expert,2018-06-01
Bitcoin and Altcoins Basing for Next Move Higher,2018-05-31
"Long-Time Bitcoin Critic, Nobel Laureate Gives a Hope to Crypto",2018-05-31
Bitcoin and Altcoins Rally Could Extend Further,2018-05-30
"How Much Does it Cost to Attack Bitcoin, Ethereum and Other Coins",2018-05-29
Bitcoin and Altcoins Trading Near Crucial Juncture,2018-05-29
"How to Throw Away 7,500 Bitcoins",2018-05-28
Market Weekly Outlook: Bitcoin Targets Fresh Lows,2018-05-28
Bitcoin and Altcoins Consolidating Losses With Positive Signs,2018-05-25
Investors: Probe into Bitcoin Manipulation Is a Good Thing,2018-05-25
"Bitcoin and Altcoins Nosedived, Tom Lee Still Predicts USD 25K per BTC",2018-05-24
Deutsche Boerse “Deep at Work” on Bitcoin Futures Trading,2018-05-24
Bitcoin and Altcoins At Risk of More Declines,2018-05-23
Bitcoin As Explained by AI Is the Next Viral Hit,2018-05-23
"Bitcoin Pizza Day Menu: Jokes, Events, New Products and Kebab",2018-05-22
Market is Caught In a Tug-of-War,2018-05-22
Market Weekly Outlook: Bitcoin and Altcoins Bounce Back,2018-05-21
Bitcoin and Altcoins are Consolidating Losses,2018-05-18
Bitcoin and Altcoins Under Pressure Despite Consensus 2018,2018-05-17
Bitcoin and Altcoins Rally Unravels,2018-05-16
"Florida County to Accept Crypto for Services, Tax Payment",2018-05-15
Bitcoin and Altcoins Are Building Bullish Momentum,2018-05-15
Market Weekly Outlook: Bitcoin Basing for Next Move,2018-05-14
Bitcoin and Altcoins Tumbled Post Upbit Investigation,2018-05-11
"Bitcoin Price Forecast Game: Up To USD 64,000 at End of 2019",2018-05-11
Huawei Targets Chinese Users with Bicoin Wallet App,2018-05-11
"Belarus Bank Offers BTC-Dollar Trading, Ukraine ‘to Legalize Crypto’?",2018-05-11
Keys to USD 10bn in Bitcoin Locked Underground on Five Continents,2018-05-10
"Meet Carol, the Future Average Lightning User",2018-05-09
Bitcoin and Ethereum Eyes Last Line of Defense,2018-05-09
Crypto Millionaire's Advice to Bill Gates How to Short Bitcoin,2018-05-08
Research: Bitcoin Dropped Due to Bitcoin Futures Launch,2018-05-08
Bitcoin and Altcoins Staging Solid Comeback,2018-05-08
NYSE's Parent Develops Bitcoin Trading Platform - Report,2018-05-08
Bill Gates Applies 'Greater Fool Theory' To Bitcoin,2018-05-07
Market Weekly Outlook: Bitcoin And Altcoins Losing Momentum,2018-05-07
Crypto Enthusiasts Try to Decode Buffett’s Hate for Bitcoin,2018-05-07
No Money for Lawsuit Against Roger Ver's Website but Mistake Corrected,2018-05-04
"Bitcoin Inches Closer to USD 10,000 Mark, Altcoins Move Up",2018-05-04
"Dr Doom vs. Captain Crypto: Fight Over BTC ''Suckers"" and ''Bulls**t""",2018-05-03
Goldman Sachs Opening Bitcoin Futures Trading,2018-05-03
Bitcoin Is In Slow and Steady Uptrend,2018-05-03
Bitcoin and Ethereum Target Fresh Highs,2018-05-02
Bitcoin.com Accused of Misleading People into Buying BCH,2018-04-30
Crypto Market Braced for Volatility after Mt. Gox Makes Massive Coin Transfer,2018-04-27
"Tim Draper on His USD 250,000 per Bitcoin Forecast: ""Spirits Told Me""",2018-04-26
Chinese Police Confiscated Mining Rig of 600 Computers,2018-04-25
Three Possible Ways to Destroy Bitcoin,2018-04-24
"""Bitcoin Will Be Bigger than the Internet""",2018-04-24
"Crypto Market Weekly Outlook: Bitcoin Targets USD 10,000",2018-04-23
Crypto Miners and Profitability: An Uphill Battle,2018-04-20
"Bitcoin, Ethereum, Ripple and Other Cryptos Zooming Higher",2018-04-20
Roger Ver Would Bribe Reddit for New Bitcoin Moderator,2018-04-20
A Job for Mt. Gox ex-CEO: Downgrading to CTO,2018-04-19
The Vomiting Camel Spotted in the Market,2018-04-19
Bitcoin Consolidates While Altcoins Zoom Higher,2018-04-19
Venezuelans Make Record Bitcoin Buys as Country Clamors for Crypto,2018-04-19
Entrepreneur to Beat Warren Buffett Portfolio With Crypto,2018-04-18
"Prices May Skyrocket Once Tax Day is Over, Traders Say",2018-04-17
"69 Bitcoin Forks, Very Few Tradeable",2018-04-16
Crypto Market Weekly Outlook: Bitcoin Could Surge Further,2018-04-16
Survey: 40% of Crypto Investors Were Driven by Curiosity,2018-04-16
Bitcoin and Altcoins Zoom Higher; More Gains Likely,2018-04-13
Reactions to the Market Jump Surprisingly Lukewarm,2018-04-13
Bitcoin Struggled While Altcoins Gained,2018-04-12
Would You Buy This Townhouse for USD 30mln - or 45mln in BTC?,2018-04-12
Customer Suing JPMorgan Chase over ‘Sky-high’ Crypto Fees,2018-04-12
"Bitcoin Is Over Like the Flu Season, Says Barclays",2018-04-11
74 Japanese Beauty Clinics Starts Accepting Bitcoin,2018-04-11
Bitcoin and Altcoins Struggled to Hold Gains,2018-04-10
How to Mine Bitcoin for Free and Make USD 5 a Year,2018-04-10
Where Is the Focus: Blockchain or Bitcoin?,2018-04-10
Bitcoin and Altcoins at Risk of More Declines,2018-04-06
Bitcoin and Altcoins Trend Overwhelmingly Negative,2018-04-05
Bitcoin and Altcoins Feel Downside Pressure Again,2018-04-04
Bitcoin Bull Makes a Case for HODLing,2018-03-29
Bitcoin Started Consolidation Whereas Altcoins Recovered,2018-03-28
"Cybercrime Gang Arrested, Used BTC to Launder USD 1.24bn",2018-03-27
Bitcoin Puzzles: A New Rewarding Pastime,2018-03-26
Crypto Market Weekly Outlook: Bitcoin and Altcoins at Risk,2018-03-26
CEO of Twitter: Bitcoin Will Be World’s Single Currency,2018-03-22
Bitcoin and Altcoins Struggle Near Key Resistances,2018-03-20
Bitcoin and Altcoins Market Weekly Outlook: Recovery Underway,2018-03-19
"Bitcoin is ""On the Edge of Mass Cryptocurrency Adoption""",2018-03-16
Bitcoin and Altcoins Recovery Remained Capped,2018-03-16
Google Ads Ban Impact: Bitcoin and Altcoins Nosedives,2018-03-15
Bitcoin Consolidates as Low Cap Altcoins Rally,2018-03-14
Bitcoin Takes a Break from Mt. Gox Until September,2018-03-13
Dogecoin Has More Transactions than Bitcoin Cash,2018-03-13
Bitcoin Price Hovering Near Crucial Support,2018-03-13
Bitcoin and Altcoins Started Substantial Recovery,2018-03-12
Bitcoin Cash Now Comes With Its Own Soundtrack,2018-03-09
Bitcoin and Altcoins in Deep Red,2018-03-09
Bitcoin and Altcoins Tumbled Post Binance Phishing Attack,2018-03-08
Most Expensive and Cheapest Countries to Mine Bitcoin,2018-03-07
Bitcoin and Ethereum Broke Key Support Levels,2018-03-07
"SegWit Transactions Are on the Rise, So is the Joy of Bitcoin Users",2018-03-01
50 Cent: From “Bitcoin Millionaire” to Bankruptcy Filing,2018-02-27
Bitcoin Fees Are Going Down - But Why?,2018-02-23
"Finland Looking For Ways to Store 2,000 Confiscated Bitcoin",2018-02-21
Bitcoin-Funded Resort On Antigua In The Making,2018-02-19
JPMorgan: Bitcoin Has No Way to Handle a Liquidity Crisis,2018-02-16
"Bitcoin Crosses USD 10,000, More Gains Likely?",2018-02-16
Bitcoin Inheritance: The Unforeseen Problems,2018-02-14
"Bitcoin Price Eyes Major Comeback, More Gains Possible",2018-02-08
"Bitcoin Dips below USD 10,000, More Losses to Follow?",2018-02-01
South Korean Court Recognizes Bitcoin’s Economic Value,2018-02-01
"5,057 Bitcoins Charity Fund Strikes Again",2018-01-31
Samsung Producing Chips For Bitcoin Mining,2018-01-31
Bitcoin Robbery at Gunpoint in England,2018-01-29
Video Game Becomes Latest to Capitalize on Bitcoin Mania,2018-01-29
"Bitcoin Corrects Lower, Trouble to Tether Mounts",2018-01-29
"Bitcoin Reverses Gains, Trump official Warns against Illicit Activities",2018-01-26
"3,000 Metric Tons of Wheat Traded for Bitcoin",2018-01-26
Internet Fury: Don't Claim Bitcoin is Not the Best,2018-01-25
Student Who Won Bitcoin: “I Will Probably Cash It Out”,2018-01-24
Nassim Taleb On Bitcoin: It’s an Excellent Idea,2018-01-23
Bitcoin Tumbles as South Korea Bans Anonymous Cryptocurrency Trading,2018-01-23
Consumer Defender Picks Fight With Bank Over Bitcoin,2018-01-22
The Usual Suspects: Who just brought my bitcoin down?!,2018-01-19
Analyst: Bitcoin Will Be Overtaken By Its Competitors,2018-01-19
How to Trade Bitcoin Without Actually Owning Bitcoin,2018-01-18
Visa CEO: Bitcoin is Not a Payment System,2018-01-18
Predictor of Bitcoin’s Death Calls for Wider Crypto-Crackdown in China,2018-01-16
Bitcoin and Ethereum on their Way to Mass Market,2018-01-03
