text,date,year
" Another shipping company has now joined the global blockchain revolution, this time it’s UPS. According to a filing with the U.S. Patent and Trademark Office (USPTO), the global shipping giant is considering setting up a system of locker banks so that it could take in Bitcoin as payment.   >>Bitcoin Price Analysis – Can BTC/USD Rebound? Here’s how it works: As outlined in the USPTO filing document, a seller can leave an item inside a locker (which can be rented) for the buyer to pick up later-on by entering the designated payment, thus completing the transaction. The aim is to create a point-of-sale (POS) system that accepts the following payment methods: However, only time will tell whether this kind of locker bank system will appeal to the general public and whether people are willing to use Bitcoins to pay for UPS packages. This is not the first time that UPS expressed its intention to dabble in the blockchain industry. In November, the company joined a blockchain consortium called the Blockchain in Trucking Alliance, focused on the trucking and shipping industry. On joining the consortium, Linda Weakland, UPS director of enterprise architecture and innovation, stated: “The technology has the potential to increase transparency and efficiency among shippers, carriers, brokers, consumers, vendors and other supply chain stakeholders.” >>The Best Cryptocurrency Memes in 2018 (So Far) With today’s announcement, we are starting to see a trend where shipping companies — which make up a vital part of the global economy — are leaning towards using Bitcoin as a mainstream method of payment. Over the past two years, more than 50 filings released by the USPTO mentioned the leading cryptocurrency as a possible inclusion into their payment systems (such as Bank of America). Earlier today, FedEx also made significant progress in developing a blockchain-based platform for its daily business operations. It might not be long before the entire sector moves into the blockchain technology. Featured Image: twitter",1-Feb,2018
" The correlation between Google search and price movement Analysts are now supporting their predictions using the Google search volume. Their assumptions are purely based on the number of people putting the bitcoin keyword into Google Search. According to estimates, Google search for bitcoin soared sharply in December. The worldwide searches for bitcoin tripled in December compared with the previous month. The strategy looks to be effective, considering the correlation between price movement, trading volume, and google searches. Colas, the first analyst to follow bitcoin said, “Google search patterns can forecast bitcoin’s future. He said he uses Google Trends to track how many people enter “bitcoin” into the search engine.” The growth in bitcoin popularity also supported the growth in numbers of wallets. However, Google search volume for bitcoin declined sharply by 75% in January and as it declined so did market value.  Source Image: coinmarketcap.com   The popularity of Bitcoin (BTC) continues declining since the start of this month after hitting its peak in December ($19,000). It has fallen back to below $10,000. As expected, the movement in Google search volume reflected the bitcoin price movement. So, why are popularity and price going down? Several factors contributed to the decline in bitcoin’s popularity; negative comments from numerous leaders and Central Banks during World Economic Forum weighed on traders sentiments and potential buyers. A Crack-down on digital currency from South Korea, India and China has also impacted the trading volume. South Korea and China have banned cryptocurrency trading through anonymous accounts, amid the threat of criminal activities and during the budget presentation speech, the Indian finance minister clearly denounced cryptocurrencies; “The government does not consider cryptocurrencies as legal tender or coin and will take all measures to eliminate the use of these crypto assets in financing illegitimate activities.” Market pundits are also blaming other blockchain technologies for the decline in bitcoin’s popularity. For instance, several payment services companies are showing their confidence in Ripple (XRP) and other blockchain technologies, due to faster transactions times than bitcoin. Stripe, the online payments company, announced it would not support Bitcoin anymore, citing a number of reasons for this move. Stripe said, “Bitcoin transaction confirmation times have risen substantially; this, in turn, has led to an increase in the failure rate of transactions. … By the time the transaction is confirmed, fluctuations in Bitcoin price mean that it’s for the “wrong” amount. … Furthermore, fees have risen a great deal … making Bitcoin transactions about as expensive as bank wires.”    Featured Image: twitter",1-Feb,2018
" India’s anti-Bitcoin sentiments have caused a crypto-wide panic to spread around the world. The country’s finance minister Arun Jaitley announced during the budget speech today that cryptocurrency was not considered legal tender in India. When the news broke, people immediately began blowing his words out of proportion. Jaitley stated that the Indian government “will take all measures to eliminate the use of these cryptoassets in financing illegitimate activities or as part of the payments system.” >> What crypto coins are best for making small payments? This doesn’t mean the Indian government is planning to outright ban Bitcoin and other cryptocurrencies. They will continue to caution against it and are planning to severely crack down on the illegal activities that result from crypto. But a full-scale ban? Not quite yet. Many people appear to have interpreted it this way, however, and cryptos have taken a rough beating today as a result. Bitcoin is down nearly 10% in the last 24 hours, dropping below $10,000, and out of the top 100 cryptocurrencies, only two coins are actually up (DigixDAO and Aeternity) at the time of writing. >> Aeternity makes the list of our 5 cryptocurrencies under $5 10% may not seem like a whole lot, but because Bitcoin holds such a large amount of the overall crypto market cap, the crypto market cap has plummetted as a result. In the course of 24 hours, the total crypto market cap has tanked by around $50 billion. What we have witnessed today is a pretty good display of what would probably happen was India to actually ban crypto. India accounts for nearly 10% of all Bitcoin transactions (coincidence that that is also the percentage that Bitcoin fell today?). If crypto loses India, that could severely damage the market. What is interesting is that India is against crypto, but not against blockchain. Jaitley also stated that “The Government will explore use of block chain technology proactively for ushering in digital economy.” So it’s not all doom and gloom. Blockchain will survive, even if crypto doesn’t. What do you think? Will India change its mind and ban crypto altogether? Or is the panic all for nothing? >> KODAKCoin ICO launch delayed Featured image: hackernoon",1-Feb,2018
" Square Cash App finally integrates bitcoin support. Following a trial period involving a handful of users, the payment company launched bitcoin integration yesterday and saw a rise in stocks as a result. To accompany the launch, Square has also released a completely adorable Bitcoin tutorial in the style of a children’s book, titled ‘My First Bitcoin and the Legend of Satoshi Nakamoto‘. Through its colorful, pop-up artsy pages, the slideshow takes readers through the fundamental basics of Bitcoin and cryptocurrency in terms an (albeit financially-minded) five-year-old could understand. Square CEO Jack Dorsey said in a tweet: “Instant buying (and selling, if you don’t want to hodl) of bitcoin is now available to most Cash App customers. We support Bitcoin because we see it as a long-term path towards greater financial access for all.” >> Turkish Soccer Team Purchases New Player With Bitcoin This is very good news for the world’s biggest cryptocurrency, which was recently dropped by online payment processor Stripe amid growing troubles with its use. Although today’s news still leaves bitcoin (BTC) in the red on coinmarketcap’s charts, Square’s stocks have risen around 3% in response. Square’s Cash app allows users to transfer funds on a person-to-person (P2P) or person-to-business basis, meaning you can pay a bill or send a friend $10. Today’s update will allow users to buy and deposit up to $10,000 USD worth of bitcoin per week, and with no additional purchase charge. In terms of pricing, Square will look across a range of exchanges to try and find an average. The only downside to all this is that technically, you don’t actually hold the bitcoin you use with Square; they do. >> Bitcoin Value Halves in January. What’s Next For the Cryptocurrency? Where bitcoins are traditionally held in a digital wallet tied to a device such as a computer, phone or even a memory stick, the coins a user owns on Square Cash are tied to their Square account, meaning they are out of the user’s hands to an extent. Some Bitcoin enthusiasts may argue that this counters the total financial freedom that Bitcoin is meant to endow. This does also present some upsides, however, as it means users can lose a device or their password and still recover their coins. In any case, crypto trading services are becoming increasingly popular as more begin to compete with Coinbase, the current standard. When trading service Robinhood announced it was to add zero-fee trading of Bitcoin and Ethereum (ETH), more than one million people signed up to the early-access waiting list. ‘Zero-fee’ is the buzzword here, as Coinbase typically charges 1.5 to 4 percent fees in the US. If Square can match this level of interest, it’s going to be a good year for the service, and possibly for cryptocurrency too. It certainly needs the rejuvenation. Featured image: Bitcoin Exchange Guide",31-Jan,2018
" This week, a Turkish soccer team, Harunustaspor use bitcoin to sign their newest player. The tiny Turkish soccer team has become the first in the world to purchase a payer using Bitcoin (BTC) or any cryptocurrency, making history. Club president Haldun Şehit proposed the deal, which amounts to a total of $1,197 USD, to player Ömer Faruk Kıroğlu, who agreed to play until the end of the season. The total amount comprises of 0.0524 BTC ($522.24 USD at the time of writing), and a further equivalent of $664.80 USD in cash. >> Soccer and Cryptocurrencies are starting to merge The deal is very small in comparison to what happens in other national leagues such as the UK’s Premier League, where signings regularly go for the equivalent of tens of millions of dollars. Indeed, Harunustaspor does not even compete in Turkey’s top football league, currently playing in the first division of Sakarya Amateur League. Yet today’s deal is still globally significant within the sport, which has been increasingly involved in cryptocurrency in recent weeks. Only last week, Arsenal signed a partnership deal with Cashbet Coin. Meanwhile, the London Football Exchange announced plans to launch its own cryptocurrency. With this in mind, Harunustapor’s offer may be small financially but it’s a huge step in terms of how digital currencies operate within sports. Quoted in Turkish-Football, Mr. Şehit said of the deal: “This is a first in Turkey and the world, and we are proud of this achievment.” Meanwhile, transferee Kıroğlu said: “This is the future. As someone open to new technology it made sense.” So what will happen going forward? No-one can really say. It could be that Harunustapor will be iconically known as the first soccer team to engage in a Bitcoin-based transfer. It could also mark the sport’s embrace of a new or alternative financial system. Or, it could simply blow over while things will carry on as usual. It’s hard to say, yet despite Bitcoin and cryptocurrency, in general, suffering big losses the past few weeks, soccer and other sports have embraced digital currency in some surprising and unlikely ways. An ICO token sale promoted by champion boxer Floyd Mayweather raised $30 million USD last year, while fans of the Dallas Mavericks basketball team will be able to purchase game tickets with Bitcoin and Ethereum (ETH) next season. This is not the first time that Turkey has pioneered cryptocurrency usage. Last month, it became the first country to settle a freight deal in Bitcoin between itself and a Russian ship delivering wheat. Do you think this is the start of a new way forward for sports teams, or will it prove to be just a trend? Featured Image: Twitter",31-Jan,2018
" Bitcoin value halves in the first month of 2018.  Despite an incredible 2017, this January has been the worst month for Bitcoin. Bulls provided a lot of support to Bitcoin (BTC) price by presenting different theories and hypothesis that it is becoming a million dollar investment, ultimately though, bears controlled the price since the start of this year.  Bitcoin started this month trading around the $14,000 level with the price hitting a monthly high of $17,500 on Jan 5. Since then, however, bitcoin’s value has declined at a sharp pace. At the time of writing, bitcoin is trading around $10,300, down 6% in past 24 hours.  Source Image: coinmarketcap.com There are two major reasons. The volatile nature of bitcoin’s price leading to panic sell-offs, and the possibility of cryptocurrency regulations. Overall, the huge volatility in bitcoin price has reduced its market capitalization to $171 billion. From its all-time high of $332 billion, this is a loss of almost half of its value. Although analysts are impressed by innovative blockchain technologies, the future of bitcoin depends highly on regulatory requirements. Several countries have begun deliberating about cryptocurrency regulations. >> The Uk and France are in talks to implement cryptocurrency regulations. Along with regulatory concerns and poor feedback from major analysts, the efficiency of bitcoin blockchain technology has significantly impacted the price. Stripe has announced an end to its support for the coin, while several other companies including MoneyGram, MercuryFX, and others have begun supporting Ripple’s xRapid product instead. Facebook has now also announced to ban ads promoting digital currencies, binary options, and initial coin offerings, warning: “They’re frequently associated with misleading or deceptive promotional practices.” The bitcoin crash amplified further since the start of this week, due to reports that the U.S. Commodity Futures Trading Commission sent subpoenas to Bitfinex and Tether, who claimed that the coin is backed by the dollar. Moreover, lower trading volume from South Korean markets after the implementations of new rules has added to traders concerns. The U.S. government has been showing their concerns for fake ICO’s; a number of companies are announcing initial coin offerings to raise the money without any business behind it. Useless Ethereum took the crypto market by storm last week, despite being totally useless. The U.S. Securities and Exchange Commission announced a strong crackdown on the illegal use of cryptocurrencies and fake ICO’s. The U.S. SEC has also announced to freeze all the assets of a Texas-based initial coin offering that claimed to have raised more than $600million. So, despite the many reasons behind bitcoin value halving in January, what do you think? Is there room for a comeback? Featured Image: Depositphotos/© rastudio",31-Jan,2018
" Judd Gregg and Bitcoin (BTC). Should we also compare bitcoin to gold? The former New Hampshire Governor thinks so. There have been a number of prominent leaders joining in on the conversation surrounding the cryptocurrency industry lately. Last week, we heard from Howard Schultz, the chairman of Starbucks. Schultz stated that while he is a fan of cryptocurrency, he does not like bitcoin. Who do you agree with? Yesterday, The Hill published an opinion piece that featured the three-term senator. Gregg is cited as saying that he strongly believes that bitcoin, a virtual currency, has the potential to change the way that the world views currency.  In the exchange with The Hill, Judd Gregg compared bitcoin to gold. This comparison has been done a number of times both this year and last year. However, this time, Gregg stated that gold has value because it is accepted by banks, while bitcoin is only supported by shareholders beliefs.  >> Read More About What People Are Saying About Bitcoin When it comes to commercial transactions, Gregg stated that bitcoin has the potential to alter how the world views these transactions. It’s not entirely surprising that Gregg has come forward with this view, considering there are a number of politicians now coming to terms with the possibilities of blockchain and cryptocurrencies.  It’s not just Gregg and Schultz who have come forward with their views on bitcoin. From Katy Perry to Joseph Stiglitz, it seems everyone has something to say about the cryptocurrency sector. Not only that, but there have been a number of companies who have made a move into the blockchain technology industry. This is a cause for concern for some, as there is a decent amount of people who fear that people are investing in both bitcoin and blockchain without having a 100% grasp of the industries.  >> More Prominent Leaders Who Have Opened Up About Cryptocurrency Regardless of what people think, however, the industry seems to have a mind of its own. One moment you think bitcoin is going to keep climbing, and the next you think of it as a bubble that is bound to burst any minute. No matter what people say, we never really know who to believe. At least, not yet.  Featured Image: wmur.com",30-Jan,2018
" Social Media Giant Facebook Bans Cryptocurrency Ads In what comes as a somewhat unsurprising move, social media giant Facebook has now banned all ads that promote cryptocurrencies — including bitcoin and ICOs — to protect its users from deceptive financial products and services.  Source: Facebook As a result of Facebook’s new policy, we won’t be able to see ads featuring people like “crypto genius” James Altucher, who has been featured in the media quite prominently because of his endorsement of the digital currency. Recently, Facebook has been a target of heavy criticism for hosting dubious ads that look to promote cryptocurrency. Some of these ads could potentially be associated with scams that are seemingly ubiquitous all over the internet right now. Many have pointed out that these ads use “fake information” to trick investors into putting money into “initial coin offerings”. >>BitConnect Officially Shuts Down — Ponzi Scheme Confirmed? Facebook is certainly not the only platform to host fraudulent promotions.  Recently, some investors were hoodwinked into buying a digital coin supposedly promoted by John McAfee — founder of cybersecurity firm McAfee — through his “official Twitter account”, only to find out later that the “tweet” they saw was actually sent from a bogus Twitter account with an almost identical Twitter handle as McAfee’s official one. This was just one of a myriad of cases where people got hoaxed into buying cryptocurrencies and became victims of such schemes in recent months. >>Nigerians Are Using An Old Approach To Beat Bitcoin Scams In its latest blog post, Facebook provided the following statement: “We want people to continue to discover and learn about new products and services through Facebook ads without fear of scams or deception. That said, there are many companies who are advertising binary options, ICOs and cryptocurrencies that are not currently operating in good faith.”  Today’s announcement marks another critical step in Facebook’s pathway to clean up its platform. Over the past few weeks, Facebook already made significant changes to its News Feed, aiming to filter out untrustworthy news sources while boosting local news outlets and posts from friends and family. Time will tell how effective Facebook’s new policy will be in protecting its users from more cryptocurrency scams, but this is definitely good news for the Facebook audience. Featured Image: Twitter",30-Jan,2018
" Bitcoin (BTC) price grew in the second half of 2017. The digital currency peaked above $19,000 at the end of last year but, lost nearly half of its value in the new few weeks. Bitcoin continues to trade in a narrow range over the last two weeks is currently trading around the $11,000 mark. Traders blame the lack of regulation for the huge plunge in prices, however, they are ignoring the growth in bitcoin miners and the decline in the cost of production. >> Hackers are Mining Cryptocurrency using Video Websites Mining is a lucrative business that doesn’t require intellectual property or specific knowledge, so it is now advantageous for arbitrageurs to easily mine bitcoin.  And thanks to low regulatory requirements, several new players are entering the mining markets. For instance, CryptoWatt, LLC, recently announced the purchase of MSE Technologies’ grounds and buildings in order to transform them into a mining operation likely to begin this March. Moreover, technology companies are making mining easier by developing chips for specifically for it. The low entry barrier will allow more arbitrageurs to start mining and this will substantially increase supply, beginning the decline of bitcoin miner’s profitability. The result will be modest profits against the cost of mining. Chairman and CEO Thomas Peterffy said, “a sharp bitcoin price decline could cause liquidity issues for the clearinghouses that could spread across financial markets and lead to a Lehman-style collapse.” >> The Next Global Hotspots for Bitcoin Mining Energy consumption is the major cost. Mining a single coin is eventually determined by how much the electricity spend is on operating a mining rig. Based on an Elite Fixture survey, South America has the potential to mine a single coin for $531. Venezuela is among those countries that offer the cheapest cost to mine altcoins. On the other hand, South Korea, driven by higher electricity costs, is the most expensive country to mine bitcoin. Featured Image: twitter",30-Jan,2018
" A British man has been forced to hand over Bitcoin (BTC) at gunpoint in what is the first armed cryptocurrency theft in the country, say reports. Danny Aston, 30, called the police to his home in Moulsford, Oxfordshire, at 9:40 am GMT on Monday after four masked robbers forced entry. The robbers reportedly demanded that Mr. Aston, an ex-financier-turned-Bitcoin-trader, transfer an unknown amount of Bitcoin to them before leaving the scene. No-one was injured in the event. Though the exact amount transferred has not been specified, it could be very large due to the nature of Mr. Aston’s work which involves his company: Aston Digital Currencies Ltd. >> Beware of the Bitcoin ATMs One mother told British newspaper The Mail on Sunday that she saw “Four young men in black tracksuits” approach Mr. Ashton’s property that day. Shortly after the incident, a local school was temporarily placed on lockdown as a police helicopter scoured the area, according to the Daily Mail. Thames Valley Police are asking for witnesses to come forward to aid in the thieves’ arrest, which will surely prove to be a challenge since Bitcoin is designed to be untraceable. Though this news is unprecedented in the UK, and especially in a small Oxfordshire town, it is not the first time that an armed cryptocurrency heist has taken place. Canadian police are searching for two suspects involved in a cryptocurrency exchange robbery on Tuesday 23rd January. Three people, armed with handguns, stormed the offices of Canadian Bitcoins in Ottawa, Ontario, in an attempt to force employees to transfer funds. The suspects fled, and one of them caught, after police were called by an employee who remained hidden, said CBC news. It is not clear whether the suspects wanted Bitcoin specifically, regular funds transferred, or physical cash. >> 2017 Was the Year of the ICO but What Will Happen to ICOs in 2018? The prospect of increasing cryptocurrency crime, especially physical robberies, won’t do much to inhibit the swathes of regulatory action being implemented by governments around the world. China, South Korea, France, and Russia are all mulling over ways to control the growing phenomenon of digital currency, and this is having a negative impact on market prices. Plus, with most cryptocurrencies being pretty much untraceable, police forces are going to have to reconsider the way they approach the issue. If you are in the UK and have any information you can call Thames Valley Police on 101 or Crimestoppers on 0800 555 111. If you have any information on the Ottawa robbery, call the robbery unit on 613-236-1222 or Crime Stoppers anonymously on 1-800-222-8477. Featured image: Caribbean National Weekly",30-Jan,2018
