text,date,year
" Will Bitcoin price (BTC) rebound this year? Bitcoin price traded in the red over the last three consecutive weeks amid downgrades from big names and price manipulation scandals. After losing billions of dollars over the past three weeks, the largest coin is now receiving strong support around the $7,000 level. However, traders are in doldrums as its becoming more difficult to predict where the cryptocurrency market will move from here.  Source Image: coinmarketcap.com Spencer Bogart, a partner at major VC firm Blockchain Capital and also one of the first Wall Street analysts to cover Bitcoin, suggests that traders should buy Bitcoin during dips. Although he presented a pessimistic outlook for the short-term, the analyst sees a sharp rebound in the third and fourth quarter of this year. Bogart expects Bitcoin price to extend its losses next month before bouncing back to $10K by the end of this year. Could Bitcoin trade lower? He says: “certainly”, but then added, “But I would bet Bitcoin ends at least above $10,000 in the year.” Bogart’s claim for the potential upside is based on higher institutional adaptation. He said, “The long-term thesis is very much intact… The institutionalization of Bitcoin is absolutely occurring…Every major bank is trying to do something in the space. Either they’re going to be offering Bitcoin to their clients, they’re working on a custody platform, or they’re opening up a trading desk.” While the Wall Street expert was bullish on Bitcoin’s price outlook, he recommended selling some altcoins that are overvalued. He believes shorting Cardano, IOTA, TRON, and NEO is a good strategy, but he was “neutral” on Ripple, Ethereum, EOS and Bitcoin Cash.  Source Image: twitter.com Spencer Bogart has highlighted a more conservative outlook then Brian Kelly and John McAfee – who both have been expecting Bitcoin price to make substantial gains, both in the short and long-term. Trader and market participants reacted positively to Bogarts claims. Featured Image: Depositphotos/© BiancoBlue",28-May,2018
" Grant West, the 26-year-old Just Eat hacker, was sentenced to 10 years in prison after the trial -resulting from a massive scam he perpetrated in 2015 – has ended. According to reports by the BBC, the scamming process lasted just five months during which Mr. West was responsible for sending bogus emails to over 165,000 people pretending to be part of the Just Eat fast food chain. In the emails, he offered a £10GBP coupon to clients in exchange for filling out a survey about customer satisfaction with the services provided. However, the survey also required there to be personal data filled out that many did in the belief they were doing it confidentially.  (courtesy BBC) West subsequently compiled this data and sold it on the Deep Web to other scammers through the now-defunct Dark Market known as Alpha Bay. He used the pseudonym “Courvoisier” for this purpose.  (courtesy: BBC) According to official information, he was able to raise £2 million worth in crypto (approximately $2.6M USD) from the sale of the “Fullz.” After tracking him down, the police were able to capture him on a train from Ryll to London. Subsequent investigations concluded that there was no attack on Just Eat’s internal servers or systems; however, the losses caused totaled figures in the hundreds of thousands of dollars. When police Raided Mr. West’s House, they found an sd card with the details of at least 63,000 credit cards, £2 million worth in crypto, 500gr of cannabis, seven million email addresses with passwords, and the corporate information of more than 500 companies. >>Addicted to Crypto Trading? There’s a Treatment Centre For That! According to the judge, the operation was a “one man cybercrime wave.” His words about West’s actions were harsh: “When such inadequate security is confronted with a criminal of your skills and ambition it is totally unfit for purpose and worthless… This case should be a wake-up call to customers, companies and the computer industry to the very real threat of cybercrime.” Mr. West, who pleaded guilty to the charges, received a 10-year sentence, while his girlfriend, Rachael Brookes, 26, was accused of trying to sell stolen information taken by her boyfriend, received a community order after pleading guilty to unauthorized access of computer material. Featured Image: twitter",28-May,2018
" John McAfee – who is known for making big price bets, has presented a bullish thesis for the next cryptocurrency market rally. He predicts a few coins – including Bitcoin (BTC) and EOS (EOS) will achieve robust price growths next month,  before collapsing in July. Bitcoin price currently trades around the $7,500 level but John McAfee expects BTC price to trade at around $15,000 next month.  He also predicts that EOS price will hit $32 next month.  Source Image: twitter.com Bears, however, don’t accept his price bet, as he’s backed claim on Trump’s meeting with the North Korean president. He tweeted: “My algorithm is still predicting the meeting between two leaders, which could take place in Japan next month.”    Source Image: twitter.com Donald Trump, on the other hand, publically denied meeting with the North Korean President after his offensive remarks. He also told Kim in the letter, “You talk about your nuclear capabilities, but ours are so massive and powerful that I pray to God they will never have to be used.” Bears say, that Donald Trump has called off the meeting, but if he meets with Kim Jong-un would John McAfee’s prediction be correct? and what would be the fundamental impact on the cryptocurrency market be? Its right that political stability always has a positive impact on investment markets, so the meeting between the head of the two countries could have the potential to create a 100% rally in price. On the other hand, the stock markets, for instance, plunged only 1% after Donald Trump refused to meet with North Korean President.  Source Image: twitter.com John McAfee, however, has previously revealed that he charges hundreds of thousands of dollars for each promotional tweet about cryptocurrency markets. So is his prediction just another paid publicity? Market reaction was strong against John McAfee’s price bet; the majority of Twitter users mocked his price prediction. What are your thoughts? Featured Image: Facebook",25-May,2018
" Tom Lee – who has been making big bets on the upside potential of Bitcoin price, is standing by his prediction that BTC will soar to $25K by the end of the year. Bitcoin price today, however, retreated below $8K yesterday and is trading around $7,300 today.  Source Image: coinmarketcap.com Technical analysts are forecasting the bearish trend will extend its momentum while trend makers and business icons are also presenting a bleak outlook for the entire cryptocurrency market. Cryptocurrencies are the most volatile asset in the world, at least in this era. This is because everything is a possibility in this market; crypto coins have created such major rallies in the past, including last year’s rally – when Bitcoin price rose from $1,000 to $20,000. At the moment, however, the market is much more mature and traders are closely inspecting all the pros and cons of digital currencies. Regulator interference and bans from several countries have also wiped off the illegal trading volume – which accounted for almost half of the trading volume during last years bull-run. Tom Lee has totally based his price bet on speculation that institutional investors will push prices higher later in the year. He said, “I think institutional investors have gained a lot of interest, and they haven’t really come into crypto yet because there is still some regulatory uncertainty. But that sort of ultimate allocation into crypto as an asset class is going to be a powerful reason why bitcoin rallies.”  Source Image: twitter.com Market reaction to Tom Lee’s claims was mixed. Some are going against his bet while others are optimistic about the future upside potential. Tom Lee, however, didn’t express his thoughts regarding Bitcoin’s potential to work as viable currency. He also didn’t speak about the “fair value” concept. Featured Image: Twitter ",24-May,2018
" Bitcoin Price Manipulation – The U.S Department of Justice just launched an investigation into whether traders are manipulating the price of Bitcoin and other digital tokens, Bloomberg reported this morning. The investigation primarily focuses on illegal practices that can influence the price of these coins, such as “spoofing” – flooding the market with fake orders to trick other traders into buying or selling. Another illicit tactic the DOJ is looking into is called ‘wash trading,’ which traders trade with themselves to create the illusion of volume. This tactic is prevalent in equity and futures markets. John Griffin, a University of Texas finance professor who has studied market manipulation, told a reporter at Bloomberg, “There’s very little monitoring of manipulative trading, spoofing and wash trading. It would be easy to spoof this market.” The DOJ’s investigation is still in its early stages and is following the country’s latest crackdown on various blockchain projects, in both Canada and the U.S. Cryptocurrency trading is fragmented in dozens of cryptocurrency exchanges and platforms across the globe, many of which are located in Asia and aren’t registered with the SEC or CFTC. The CFTC doesn’t regulate the trading of cryptocurrency, but if it finds fraud in the ‘spot market,’ it holds the authority to impose sanctions. Red Flags The Winklevoss Twins, who own the Gemini Exchange, conducted a surveillance of the digital coins being traded on their platform last month. The twins then urged other trading platforms to band together to potentially form a group that would ‘self-regulate’ the industry. It seems that the duo sensed the government oversight drawing near. Many market participants have alleged that cryptocurrency manipulation is rampant, and you can clearly see that by the hundreds of ‘pump’ tactics initiated a day. The question then that remains is – how do we stop it?  Not the regulators, or the government, but us, the cryptocurrency enthusiasts and investors. Can it be stopped without these regulators intervening? Leave your thoughts in the comment box below! Featured Image: Canva",24-May,2018
" Bitcoin Price plummeted below the $8000 level today for the first time in last the last thirty-five days. The constant bashing from business icons and trend makers are the most prominent drivers for the steep selloff. Bitcoin price lost 20% of its value since it hit the $9,900 mark on May 12. The selloff is quite surprising for bulls as they were expecting BTC price to generate solid gains considering Goldman Sachs, NASDAQ, and Intercontinental Exchange are all now backing the coin.    BKCM founder Brian Kelly was also stunned by the market behavior. He believes the entrance of Wall Street into the cryptocurrency market isn’t a small event. Trend makers and remarks from influencers always have a substantial impact on investing markets. Stock market experts, business icons, and Fed’s officials have been expressing negative thoughts for the cryptocurrency market. Warren Buffett, Bill Gates, PayPal CFO and Ali Baba founder all have rejected the use of cryptocurrencies as the viable currency. Some of them have criticized crypto coins on higher volatility while others believe it doesn’t have any store of value. This is because they expect Bitcoin and other digital currencies might have a bad ending. A bearish outlook for Bitcoin price from St. Louis Federal Reserve President James Bullard’s added to the selling pressure. Minneapolis Federal Reserve president Neel Kashkari has also banged the cryptocurrency market, saying it has become a “farce” due to unregulated chaos and escalating fraud.  Bulls have failed to defend Bitcoin price and the rest of cryptocurrency market. The entire market has been declining at a steady rate over the last two weeks, resulting in the loss of over 100 billion from total market capitalization since May 12. Although Bitcoin bull Tom Lee blames a lack of regularity clarity for the recent losses, retail investors are coming up with reckless claims. Featured Image: twitter",23-May,2018
" Joe Davis; Vanguard economist believes that Bitcoin price (BTC) will crash to zero, and it will never emerge as reliable currency. Bitcoin price remains range-bound after falling 15% from three months high of $9,900 level. The bearish trend has been receiving support from influential icons. The debate over the use of Bitcoin as a medium of exchange is also contributing to the sell-off. Bitcoin price trades around the $8,300 level today. Altcoins are in the red after a short rally at the beginning of the week.  The total cryptocurrency market hovers in the range of $380 billion, down from $465 billion it hit a few days ago.  Joe Davis, the chief economist for $5.1 trillion asset management firm Vanguard, thinks cryptocurrencies aren’t the alternative of fiat currency. His stance is similar to PayPal CFO and Warren Buffet – who already has rejected the possibility of using Bitcoin as the medium of exchange. The economist of the $5.1 trillion asset management firm warned investors that Bitcoin price is likely to crash to zero. He suggested investors keep their focus towards “tried and true asset classes”. He believes that allocating even a small portion of the investment portfolio to cryptocurrencies could turn out to be a big mistake. He said, “The investment case for cryptocurrencies is weak. Unlike stocks and bonds, currencies generate no cash flows such as interest payments or dividends that can explain their prices. National currencies derive their prices from the underlying economic activity of the countries that issue them. “ The economist further argued that cryptocurrencies could be used as a medium of exchange, but they don’t have a store of value. Although the majority of market participants believe the higher level of volatility in cryptocurrency prices makes it harder for the global community to use it as a medium of exchange, they think the market needs some time and more regulation clarity for complete stabilization.  Twitter users reacted strongly against Joe Davis arguments. Cryptocurrency followers are comparing Bitcoin and other virtual currencies with the early age of internet and the Dow Jones. Featured Image: twitter",22-May,2018
" Today, May 22nd, is Bitcoin Pizza Day. What does that mean, you may ask? Well, back in 2010, one of the earliest Bitcoin (BTC) purchases was completed. The purchase was for two Papa John’s pizzas. The price back then? 10,000 BTC. Since that fateful day, Bitcoin’s price has skyrocketed and many other cryptocurrencies have sprung forth from Bitcoin’s success. Back in the day, 10,000 BTC may have only gotten you two pizzas. But what can that much Bitcoin get you now? >> TRON (TRX) Update: Upbit and Bithumb Support TRX Token Swap Right now, one BTC is selling for $8,260.43 according to data from CoinMarketCap. Although Bitcoin is currently down for the day by 1.94%, at $8,260.43 for one BTC, that still puts the price of 10,000 BTC at a whopping $82,604,300. $82 million is a lot of money. How much exactly? Let’s put that a little more into perspective by seeing what you can buy for $82 million. >> Litecoin (LTC) News: LTC Being Added to Wallet and dApp Browser Toshi We’ll start things off where they began – with pizza. One large pepperoni pizza from Papa John’s costs $19.74 today. For $82,604,300, you’d be able to buy 4,184,614 large pepperoni pizzas from Papa John’s today. That’s a lot of pizza! Hope you like pepperoni. With $82,604,300*, you can also buy: 78,223 plane tickets from Vancouver, Canada to Tokyo, Japan. 706,019 one-day passes to Disneyland in California. 121,234 ETH at the current price ($681.36). 3,304,172 bottles of wine (assuming an average price of about $25). 82,686 12.9-inch iPad Pros with 128 GB of storage. And so, so much more. Now, the question is, how many of these things would actually accept Bitcoin as payment? That’s a whole other issue. But for right now, let’s just revel in the amount. So, happy Bitcoin Pizza Day everyone. I hope it’s extra cheesy. What would you buy if you had 10,000 Bitcoin? >> Research Says Bitcoin Power Consumption May Account for 0.5% of the World’s Energy *Prices are rounded and don’t include tax Featured image: Reddit",22-May,2018
" Bitcoin price (BTC) is crashing instead of rallying: Bitcoin price has failed to generate gains for investors since Warren Buffett, and Bill Gates rejected the cryptocurrency markets two weeks ago. Bitcoin price lost almost $1,800 in the last two weeks.  Several other industry experts are also refuting bitcoin’s potential to work as an alternate currency. They believe the higher level of volatility makes it difficult for the general public to use it as the medium of exchange.  Source Image: coinmarketcap.com Bitcoin price crashed to the $8,000 level today. The New York consensus summit also failed to fuel any rally for the largest coin. PayPal CFO John Rainey has rejected bitcoin’s potential to work as the medium of exchange, particularly for merchants that have low margins on their trades.  Source Image: twitter.com Rainey claims that merchants usually have a 10%-15% margin on their products. Bitcoin, on the other hand, has the potential to create price movements of 10%-15% in few hours alone – this makes it difficult for merchants to accept BTC as the tool of payment. Talking about the possibility of accepting Bitcoin in future, the CFO said, “You could have something that appeals to consumers, but if merchants don’t accept it, it’s of little value. Right now, we don’t see a lot of interest from our merchants. But if it’s something that stabilizes in the future and is a better currency, then we’ll certainly support that.”  Source Image: twitter.com The market has been apparently supporting Rainey’s stance. The price volatility in cryptocurrency markets is higher than any other asset or currency. Some market participants expect increasing regulators role could help in reducing the price volatility in the long-run.  Source Image: twitter.com Others reacted strongly to PayPal’s CFO’s comments. They believe the threat of cryptocurrencies on banks and payment service companies has been forcing them to reject digital currencies as the medium of exchange. Featured Image: Depositphotos/© zephyr18",18-May,2018
" The Bitcoin (BTC) bubble theory has resurfaced again, as the founder of world’s largest e-commerce platform, Alibaba, just announced his views of the world’s first digital token. Jack Ma Yun, Alibaba Group’s founder and executive chairman, spoke in a forum on Wednesday and spoke highly of blockchain technology, but expressed his doubts about Bitcoin (BTC). “There is no bubble for blockchain, but there’s a bitcoin bubble,” Ma said in a panel at the second World Intelligence Congress forum. Ma said he has been researching blockchain for years and highly believes in its potential to solve security, and data privacy. The founder thinks that blockchain can be used by everyone including individuals, corporations, and even governments. Ma expressed security a top priority for his company, as Alibaba conducts ‘trillions of transactions’ a quarter. Ma said: “Social networks may not need blockchain, but we are doing internet finance in which we process trillions of trading volume. We have to turn to blockchain, otherwise, it would be fatal.”  The company reported $39.9 billion in yearly revenue in its latest fiscal Q4 earnings release. Alibaba currently has 43 published blockchain patent applications, which is followed by Bank of America which has 33. Standing Ground Ma said he first saw blockchain as a privacy and security solution, but never thought to turn it into something like Bitcoin (BTC) to make money. Clearly, the founder doesn’t understand the need to break away from central banks and hasn’t read the official whitepaper. Ma is one of Asia’s richest men, and his latest attitude towards Bitcoin (BTC) highly resonates with the Chinese government’s recent actions. However, in an interview back in December 2017, the founder told CNBC Shanghai:  “I don’t know about Bitcoin at all. I’m particularly puzzled. Even if it can really work, the rules of global trade and the financial system will be completely changed… We have a team that studies blockchain, but Bitcoin is not something that I want to pursue. We don’t care about Bitcoin.” It seems that Ma has always felt this way about the digital token, and the e-commerce giant won’t ever see Bitcoin (BTC) on its platform. Well, never say never – we’ll see. >> Tom Lee Bitcoin Prediction Fail Featured Image: News",18-May,2018
" Bitcoin shows no growth: Bitcoin Price (BTC) hasn’t moved higher despite the Consensus Summit: Bitcoin price trades in the range of $8,300 today after briefly touching $8,800 level at the beginning of the week. The largest coin has posted losses in last two consecutive days. This downside move is contrary to analyst’s predictions who were expecting a strong rally amid the New York consensus summit. Indeed, Tom Lee – who has predicted Bitcoin price to reach $25K by the end of this year – failed to predict the price movement during the consensus summit correctly.  Tom had anticipated bitcoin price to jump from 10% to 70% amid Coindesks conference. The price movement in the last three days was also quite contrary to historical precedents. BTC coin grew almost $2,000 in the previous year’s conference call, and it had made similar strides in 2014 and 2015. Two consecutive days of downside strides pulled Bitcoin price to an almost four-weeks-lows on Wednesday before moving back to $8,300 today. Although several experts presented the bullish outlook for cryptocurrency market during the New York conference call, bearish remarks from the Federal Reserve President at the beginning of the call created the selloff in the crypto markets. St. Louis Federal Reserve President James Bullard said cryptocurrencies are operating like non-uniform currencies – which, at least historically, been discarded and replaced in global financial markets. The president also believes that Dollar is in the better position to work as the leader in currency markets. Bullard said. “The dollar, on the other hand, is backed by a stable government with direct and sensical monetary policy and persistently low inflation — because of that, it can better achieve the goals and meet the needs of the market.” The selloff also received support from Bing’s cryptocurrency ad-ban policy. Powered by Microsoft, Bing is the second largest search engine in the world. Bing considers cryptocurrency ads to be harmful to their audience due to their unregulated nature. The Microsoft policymaker said, “Because cryptocurrency and related products are not regulated, we have found them to present a possible elevated risk to our users, with the potential for bad actors participating in predatory behaviors or scamming consumers.” Featured Image: twitter",17-May,2018
