text,date,year
" The cryptomarket is rallying today from the emergence of a Bitcoin golden cross. Now, the majority of the top ten cryptocurrencies by market cap are in the green according to CoinMarketCap. Leading the rally with a 5% gain at the time of writing is Bitcoin (BTC). The current price of $5,599 USD per coin is a new high for Bitcoin in 2019, and the bulls are excited. But the news gets better for Bitcoin fans because, as stated, the first Bitcoin golden cross since October 2015 has formed. A golden cross is a technical chart pattern that indicates a major rally is on the horizon. According to Investopedia: “The golden cross appears on a chart when a stock’s short-term moving average crosses above its long-term moving average.” So with this bullish signal, Bitcoin looks set to change to a “long-term bearish-to-bullish trend.” If it can close above the $5,500 mark today, Bitcoin could rally to $6,000 USD in the coming days. The Bitcoin golden cross isn’t the only signal to indicate a rally. Tom Lee’s Bitcoin Misery Index (BMI) is spurring on the positive sentiment also. Recently the Fundstrat Global Advisors founder stated that his company’s Bitcoin sentiment indicator recently touched a value of 89. According to his expertise, this means a “bull market is likely starting.” Lee noted that the BMI was over 50 throughout 2018 and has never appeared in a bear market. April has been a good month for Bitcoin price. Growing 35% already in this month, the Bitcoin golden cross now signals further gains to come. This growth spurt means Bitcoin is on track to have the best month since December 2017, when the Bitcoin frenzy was in full swing. >> IIN Blockchain Expanding: How JPMorgan Wants to Improve Banking As is usual with the cryptocurrency market, where Bitcoin goes, altcoins often follow. Other major gainers in the top ten today include Bitcoin Cash (BCH) and Cardano (ADA), up 3.52% and 2.5% respectively. The second largest coin by market cap, Ethereum (ETH), is currently up 2.17% and selling for $174.85 USD. On the other hand, Binance Coin (BNB) and Stellar (XLM) are down today, 2.17% and 0.29% respectively. What do you think? Is the Bitcoin golden cross a strong indicator of a bullish run on the horizon? Featured Image: DepositPhotos © 1StunningArt",23-Apr,2019
" If you want to buy things on Amazon using Bitcoin, you now can. All you need is the Bitcoin lightning network and crypto payment processing startup Moon. In time, the service will extend to many e-commerce sites also, not just Amazon. Let’s check this out. The startup announced today that any lightning-enabled wallet can now be used through Moon’s browser extension. Before this, the service could be used by connecting the browser extension to exchange accounts like Coinbase. According to Moon CEO Ken Kruger, it works like this: “[The extension] will pop up a QR code and it will have the lightning invoice, which you could also copy and paste if you can’t use the QR code for some reason, and you’ll be able to pay with your favorite lightning wallet.” Customers should note that Amazon has nothing to do with the Bitcoin payment. The conversion from Bitcoin to fiat currency is taken care of behind the scenes by an unspecified third party. Therefore, Amazon merchants receive fiat currency and never have to deal with Bitcoin, but the user gets to use Bitcoin as he/she so wishes. Kruger maintains that the lightning-enabled feature should work on almost any e-commerce site by 2020 as “there’s no direct merchant integration.” This is also regardless of whether that platform accepts Bitcoin directly. Aside from Bitcoin, Moon also manages payment channels, offering an interface for sending payments. As Kruger furthered: “We’re integrating with the Visa and Mastercard networks and we get a cut of the interchange fees that merchants pay every time they receive a credit card transaction.” >> Cryptocurrency Bear Market Wanes: Going through Accumulation Founded in New York last year, Moon is looking very promising. Born of a $100,000 investment, the company has already come quite far and is now looking for a Series A funding round in 2019. Further, the company is looking for “opportunities to help solve some of those usability problems” and to “engage with other folks in the lightning community to see what people are doing, what they’re working on and if there are any significant gaps. We’d love to step in and help whenever possible.” What do you think? Would you use Moon to buy your wares on Amazon? Featured Image: DepositPhotos © belchonock",22-Apr,2019
" The cryptocurrency top ten are in the green! Well, eight of them are at least. According to CoinMarketCap, the total cryptocurrency market cap today is $182,807,737,820. As usual, when Bitcoin price is in the green, the rest of the market tends to be too. At the time of writing, Bitcoin is showing gains of a respectable 1.13%—a continued increase from a bull run now lasting over a week. Further down the chart, EOS is running away with a 6.84% increase. What has Bitcoin in the green as of late? The entire market is bullish so let’s check out why this is. At the time of writing, Bitcoin price is $5,285.08 USD, up 1.29% at the time of writing. Bitcoin has been on a bull run since April 2nd and not only has maintained the high but has continued to steadily increase. Over the course of a few hours on April 2nd, Bitcoin jumped from approximately $4,110 to $4,800. Now it has hit a current high of over $5,285. The rally has extended throughout the market with other coins also showing massive growth. For example, Litecoin gained over 50% and Bitcoin Cash roughly 80% in the same period. Two theories have emerged as to what caused Bitcoin to suddenly jump. The first is that $100 million worth of BTC was bought across exchanges Coinbase, Kraken, and Bitstamp by one person. A sudden pump of money into the market spurred on further bullish sentiment, and the gains have continued. >> How Cryptocurrency Traders Benefit from Blockchain Technology Another theory is that because Bitcoin mining rewards will “half” in May of 2020, interest to buy BTC has sparked. The idea is to accumulate it now for the future when Bitcoin will be harder to mine and therefore become more scarce. As with any product, when it becomes more scarce, it becomes even more valuable. When mining rewards do halve in 2020, Bitcoin price can be expected to jump. So far in Bitcoin’s history ‘Halving’ has occurred twice–once in 2012 and once in 2016. What do you think? Do you have you a theory for the recent bull run? Featured Image: DepositImages © AntonMatyukha",10-Apr,2019
" Cryptocurrency investment is on the rise right now, especially due to the recent Bitcoin uptick. BTC’s recent climb attracted Chinese investors, but they’re paying a premium price because they have to pay extra to purchase over the counter. China previously banned cryptocurrency exchanges from operating within its borders and also banned crypto trading. However, Chinese crypto investors have been using OTC platforms to access the cryptocurrency markets. The downside is that they have to purchase Bitcoin and other cryptocurrencies at a higher price than the officially listed market value. Some of the OTC platforms include Huobi and OKEx, among others. The recent surge in the price of Bitcoin seems to have revived the cryptocurrency investment appetite of Chinese investors, who have kept off the market for quite some time during the lengthy bear market. The return of Chinese investors to the Bitcoin investment scene has led to speculation that they had something to do with the surge. A cryptocurrency researcher called Anton Pagi stated that the Bitcoin surge happened after a notable uptick in trading volume on exchanges that have been associated with Chinese traders. Pagi even referred to a data analysis chart provided by CoinLib, a data analysis provider. The chart showed that there was a large Chinese fiat investment into Bitcoin and other digital currencies. >> Cryptocurrency Witnesses Better Returns than Equities This Year A news outlet called cnLedger revealed that Chinese cryptocurrency investors have recommended a ‘strong buy’ rating on Bitcoin. It also reveals that Chinese investors are using over the counter platforms as their main avenue of purchasing cryptocurrencies. Chinese investors are reportedly so confident about their bullish approach that they are willing to purchase cryptocurrencies at premium prices. There is a high likelihood that the average bullish outlook and premium Bitcoin purchases are behind the recent surge in Bitcoin prices. Chinese investors have thus been positioning themselves to take advantage of the bullish market. Featured image: Pixabay",9-Apr,2019
" It’s a bullish day in the cryptosphere. Paypal makes a blockchain investment and Bitcoin jumps above $5,079 USD. Bitcoin gained 21% in early trade and has now slightly corrected back down to $4,712 according to CoinMarketCap. However, no one knows why the Bitcoin jump happened in the first place. Now, some investors wonder if the rally was the result of some sort of April Fool’s joke. Zhao Changpeng, the chief executive officer of Binance, tweeted earlier today that he was “clueless” about what may have triggered Bitcoin’s jump. Packing on over $600 in one night, the last time Bitcoin hit levels like this was in November. The top cryptocurrency plunged more than 70% in 2018 and has been stagnating through most of 2019 thus far. This period has been dubbed the “crypto winter,” and while today’s rally is impressive, analysts believe that “the bounce is not enough to reset crypto winter.” According to Julien Auchecorne, London-based chief operating officer at XBTO International: “we have no major new products and last year’s big breakthroughs are still in their nascent stage.” For Bitcoin’s jump to sustain itself, then bulls should hope for a bigger fundamental reason for the coin to climb. Elsewhere in the blockchain industry, payment giant PayPal has made its first blockchain investment debut. >> Bitcoin Price Jumps 20% on Technical Breakout: More Coins Follow Announced today, PayPal has joined a Series A funding round for Cambridge Blockchain, a startup that helps financial institutions and other companies manage sensitive data using shared ledgers. The investment amount has not been disclosed but what is known thus far is that Cambridge Blockchain has so far raised a total of $3.5 million in new equity. The firm has several investors who have backed it over the past nine months. So far, the blockchain startup has raised a total capital of $10.5 million. This is the first investment PayPal has put into a blockchain company. The move may help to encourage greater adoption of blockchain technology and its relevant assets. Between the massive Bitcoin jump and PayPal’s blockchain investment, there is good news all round in the cryptocurrency industry today! Featured Image: Pixabay",2-Apr,2019
" Twitter and Square founder Jack Dorsey has always been bullish in his Bitcoin views. So it’s no surprise that his payments startup Square is now offering new employees the chance to be paid in Bitcoin. According to tweets from the CEO, the company is on the hunt for skilled labor to add to the team. If Dorsey’s tweets are anything to go by, then the company is hiring engineers and a designer to “work full-time on open source contributions to the bitcoin/crypto ecosystem.”  The Square cash app already supports Bitcoin purchases and sales so it is intriguing to think of what these new hires may be working on.  But beyond that tweet, information is scarce. However, what is notable, is that these new hires will be able to be paid in Bitcoin if they so choose. It makes sense that Square would offer this option, Dorsey being a major advocate of cryptocurrency, earning himself the nickname Bitcoin Evangelist. His belief is that Bitcoin should become the world’s single native currency and using it is moving forward. >> Polymath Partners with SeriesOne for Security Token Issuance Dorsey added in a separate Tweet that “the most impactful thing” his company can do is to build upon the current cryptocurrency ecosystem. And this is one way it can give back to the community. He commented: “Square has taken a lot from the open source community to get us here. We haven’t given enough back. This is a small way to give back, and one that’s aligned with our broader interests: a more accessible global financial system for the internet.” Dorsey recently spoke in a podcast about the Square app saying how payment apps like it are the future for cryptocurrency: “We’re empowering the electrician to send invoices, setting up the food truck with a delivery option, helping the clothing boutique pay its employees, and giving the coffee chain capital for a second, third, and fourth location.” What do you think? Would you like a job working for Square? Featured Image: DepositPhotos © sdecoret",21-Mar,2019
" Apple co-founder Steve Wozniak has spoken out about Bitcoin in a revelation that many would consider bullish in sentiment. Wozniak, in an interview with Bloomberg, has said of the coin that “we’ve seen massive value creation.”  He also puts most of the market volatility down to fear-mongering and psychology. The co-founder of Apple has always spoken highly of the coin and once said it would become the world’s single currency. The interviewer challenged him on this view asking him if he still had the same opinion considering “we’ve seen massive value destruction in Bitcoin.” But to that question, Steve Wozniak remained as bullish as ever about Bitcoin by saying: “I’m not sure I can buy that we’ve seen massive value destruction, I think we’ve seen massive value creation.” The tech icon has owned Bitcoin in the past. In the interview, he elaborates on this saying that he only kept it to experiment with and to experience the coins development, not for profit or typical investment reasons. He explains how he sold it when the price got really high: “I don’t want to be one of those people watching the price of Bitcoin, so I sold out.”  ",27-Feb,2019
" JPMorgan analysts are taking jabs at Bitcoin once more. The executives at this major US bank have never been fond of digital currency and blockchain technology. Jamie Dimon, JPMorgan’s CEO, temporarily pulled back on his comments when BTC hit its all-time highs. Shortly after, the coin began to crash, and his skepticism picked up again. According to a Bloomberg report, the bank’s analysts say that it costs more to create one Bitcoin than it’s worth. In Q4 2018, it cost around $4,060 to mine one BTC and currently, the price of the digital currency is $3,584.07. Not all miners are paying that top dollar to mine though. Low-cost Chinese miners can pay much less, mining at around $2,400. Natasha Keneva was one of the JPMorgan analysts that released their cryptocurrency report to major news outlets. She claims that these low-cost miners leverage direct purchasing agreements with electricity generators that are looking to sell excess power. On top of the price, the bank as a whole believes that the true value of digital currencies like BTC is still unproven. The analyst said: “Even in extreme scenarios such as a recession or financial crises, there are more liquid and less-complicated instruments for transacting, investing and hedging.” >> Binance Launches OTC Trading Desk, Following Bittrex The cryptocurrency market has been steadily awaiting the flood of Wall Street investments that haven’t occurred on a large-scale like some would have hoped. Bitcoin futures, OTC trading desks, and the hope of Bitcoin ETFs were made to entice pension funds and asset managers, but none have budged. The prices of digital currencies rose towards the end of December but have quickly corrected, and all gains are almost lost once more. The JPMorgan analysts say that marketplaces, where individuals and small businesses have control over payment methods, would be the most useful for the spread of digital currencies. However, these analysts feel its volatility, propensity for illicit use, and security flaws should all be considered. Featured Image: Depositphotos © eivanov
",25-Jan,2019
" Bitcoin price is showing resilience in the face of adversity. The latest bad news has failed to knock BTC to the floor. So is there a bull run ahead? Yesterday, the Chicago Board Options Exchange (CBOE) BZX equity exchange withdrew its request to list a Bitcoin ETF (exchange-traded fund). The news surely has disappointed Bitcoin traders, but it has yet to be reflected in Bitcoin price. CBOE requested a rule change by the US SEC that would have allowed a Bitcoin ETF listing to be plausible. This potential ETF was backed by VanEck and SolidX. At the time of writing, BTC is selling for $3,606 USD and down by a slight -0.24% according to CoinMarketCap. But this could be far worse considering the negative climate, if the history of the coin is anything to go by. The cryptocurrency market has been eagerly anticipating a Bitcoin ETF for some time now. Approval for one would not only give the coin increased legitimacy in the eyes of governmental and financial bodies, but it would more than likely trigger a massive bull run. To date, applications for a Bitcoin ETF have been sent in and rejected by the SEC in their droves. These have included applications from the Gemini exchange, Bitwise, Proshares, and Direxion, to name only a few. Rejection tends to reflect negatively on the market and on Bitcoin price in particular, which usually decreases steeply on the news. >> John McAfee Will Run His Presidential Campaign Overseas It is interesting to note that today’s rejection is barely affecting Bitcoin price. BTC continues to trade in a sideways manner above $3,500 as it has done all week. The calm response to the bearish news may simply be market exhaustion. It could also be that this ETF approval was never really expected anyway considering the ETF history. Perhaps the blow was almost anticipated anyway. Either way, some analysts are predicting a bull run ahead as investors choose to stay calm over the news rather than panic. Featured Image: Depositphotos © Paulpaladin",24-Jan,2019
" According to a Russian economist with ties to the Kremlin, the superpower is preparing a massive $10 billion USD investment in Bitcoin to replace its US dollar reserves. Russia’s Bitcoin investment is a step to minimize US sanctions on the country. Vladislav Ginko, an economist at the Russian Presidential Academy of National Economy and Public Administration, said the Bitcoin investment was a step taken to avoid US sanctions on Russia. Ginko believes that Russia’s decision to hold Bitcoin as a reserve currency instead of the US dollar is a move being made to “protect [Russia’s] national interests” in light of a possible interruption of “US nominated payments flows for Russian oil and gas.” Russia’s Bitcoin investment is expected to begin in February. Mr. Ginko furthered: “[The] Russian government is about to make a step to start diversifying financial reserves into Bitcoin since Russia [is] forced by US sanctions to dump US Treasury bonds and [take] back US dollars […]These sanctions and the will to adopt modern financial technologies lead Russia to the way of investing its reserves into Bitcoin.” US sanctions have hit the Russian rouble hard. Now the superpower wants to replace some of its US dollar reserves with the world’s largest cryptocurrency by market cap. >> Are Stablecoins the Future? The Winklevoss Twins Seem to Think So! Recent US sanctions on Russia came after the poisoning of former Russian military officer Sergei Skripal in London. The former Russian military officer was a double agent for the UK’s Intelligent Services. Two active Russian military intelligent officers attacked Sergei and his daughter Yulia, with a nerve agent. Cryptocurrencies are very popular in Russia and even receive approval by the country’s President Vladimir Putin. According to Ginko, the cryptocurrency industry accounts for 8% of Russia’s GDP. The Bitcoin investment is not the only sign of ‘de-dollarisation’ by the country. It has recently bolstered its supply of the euro, Chinese renminbi, and Japanese yen. Featured Image: Depositphotos © KostyaKlimenko",14-Jan,2019
" According to a US Government SEC registration form, cryptocurrency index fund provider Bitwise Asset Management has applied to launch a new Bitcoin Exchange Traded Fund (ETF) with the government body. An ETF is a platform that tracks and trades an asset in the same way as stocks are traded on an exchange. Will Bitwise manage to succeed where so many others are failing? Bitwise’s proposal is for an ETF that tracks the value of Bitcoin via the Bitwise Bitcoin Total Return Index. This value is “calculated based on the prices of Bitcoin that the Index Provider derives from Bitcoin price transactions occurring on cryptocurrency exchanges.” Basically, the index will take Bitcoin’s value from a variety of crypto exchanges and will, therefore, offer a more accurate and precise market value for the coin. This is one difference that Bitwise’s ETF proposal offers that previous ETF proposals—which have all been rejected—did not. Another difference on offer with Bitwise’s ETF proposal is that it would need “regulated third-party custodians to hold its physical bitcoin.” The company’s Global Head of ETFs, John Hyland, spoke of this in the press release: “Having a regulated bank or trust company hold physical assets of a fund has been the standard under US fund regulation for the last 80 years, and we believe that is now possible with Bitcoin.” >> Ethereum Classic Attack: Gate.io Will Return Most Funds Bitwise is still awaiting a decision from the SEC on a previously filed ETF that would track the Bitwise HOLD 10 Private Index Fund. The approval of a crypto ETF has yet to happen, although the industry has been crying out for one. In December 2018, the SEC postponed its decision on a Bitcoin ETF by investment firm VanEck and blockchain company SolidX. It is now expected to make a decision by the end of February. Featured image: DepositPhotos © cookelma",10-Jan,2019
" Charlie Lee is at it again. The Litecoin founder isn’t shy when it comes to voicing his opinion on crypto via Twitter and yesterday was no different. It seems this time, he’s targeting Bitcoin maximalists. It all started with a poll. Some self-proclaimed Bitcoin Maximalists are actually Bitcoin Extremists. They think all other coins are scams and will go to zero. Maximalists think Bitcoin is and will remain the dominant cryptocurrency but there is room for altcoins to exist and even do well. What are you? — Charlie Lee [LTC⚡] (@SatoshiLite) January 6, 2019  It seems Mr. Lee isn’t happy with a group of self-proclaimed Bitcoin maximalists. The Litecoin founder goes even as far as calling them “extremists,” which isn’t generally a positive thing to call someone. In 23 hours, Charlie Lee has collected over 28,000 votes on his poll and Bitcoin maximalist has taken over the majority of it. At press time, Bitcoin extremist has 9%, altcoin maximalist has 33%, and nocoiner has 10%. That leaves the remaining 48% to individuals who deem themselves Bitcoin maximalists. Traditionally, maximalists believe that Bitcoin (BTC) is the top cryptocurrency and the one to use day-to-day. Where Lee seems upset is that a group of these maximalists have attacked his own project and feel there is no space for any altcoins in the industry. This is what prompted the Twitter poll and attack on these so-called “extremists.” Others had their own take on the poll and subject, as usual. ""Supremacists"" has a more negative connotation… In recent years, ""extremists"" has been used more and more to simply mean ""someone who actually believes what they say they do"". — Luke Dashjr (@LukeDashjr) January 7, 2019  Another person actually knocking Litecoin said: I've always thought you seemed like a super good person and for a time I accumulated LTC. That being said I sold all my LTC this year for Bitcoin, and that was not out of ideology. It was a selfish, financial calculation I made because I don't see an enduring reason for LTC. — John Fever [sold BCH at $6K] (@ProgrammableTx) January 6, 2019  Not sure why the person above bought Litecoin because they thought Charlie Lee was a “good person” but that’s probably someone that shouldn’t be investing—just my opinion. Binance’s CEO even joined into the conversation. >> Monero “Mistake”—Now You Can’t Pay for Fortnite Merch with Monero Will be interesting to see how this plays out. But I believe in thousands of blockchain sand millions of tokens. Freedom implies choice. — CZ Binance (@cz_binance) January 7, 2019  From all the rest of the conversation via the initial tweet, it seems Lee isn’t the one who made up the term Bitcoin maximalists. He took that from Vitalik Buterin, Ethereum’s co-founder. It remains unclear why Bitcoin (BTC) supporters need to be placed into a category, but the altcoin leaders, like Charlie Lee, obviously feel it’s necessary. According to CoinMarketCap, BTC broke over the $4,00 threshold recently and is currently trading at $4,044.75 a coin, down – $0.97%, in 24 hours. Featured Image: Depositphotos © GekaSkr
",7-Jan,2019
